{"deals":[{"card_encoding":"project_target_v1_suit_major_hdcs_rank_2_to_ace","deal_id":"sha256:ec3e27471e1682019c3118c5672f482b06ff66de3444ee0fa5a899a1ee3309b8","dealer":0,"hands":[["2H","3H","4H","5H","6H","7H","8H","9H","10H","JH","QH","KH","AH"],["2D","3D","4D","5D","6D","7D","8D","9D","10D","JD","QD","KD","AD"],["2C","3C","4C","5C","6C","7C","8C","9C","10C","JC","QC","KC","AC"],["2S","3S","4S","5S","6S","7S","8S","9S","10S","JS","QS","KS","AS"]],"ruleset_id":"project_target_v1","schema_version":"tuppi.engine.explicit_deal.v1"}],"initial_dealer":0,"initial_score":[0,0],"match_input_id":"sha256:a53a66d30c4f327105a3b31f54a7fe6ee1c977cd396e410e5d105eec622d9296","match_ref":"example-all-nolo","ruleset_id":"project_target_v1","schema_version":"tuppi.engine.match_input.v1"}
