{"deals":[{"card_encoding":"project_target_v1_suit_major_hdcs_rank_2_to_ace","deal_id":"sha256:1479de8c620c8d4b0fc89dd22ced9d85590c51b10ff52fb72d42eb3c7a3ad3b2","dealer":0,"hands":[["2H","3H","4H","5H","6H","7H","8H","9H","10H","JH","QH","KH","2D"],["AH","3D","4D","5D","6D","7D","8D","9D","10D","JD","QD","KD","AD"],["2C","3C","4C","5C","6C","7C","8C","9C","10C","JC","QC","KC","AC"],["2S","3S","4S","5S","6S","7S","8S","9S","10S","JS","QS","KS","AS"]],"ruleset_id":"project_target_v1","schema_version":"tuppi.engine.explicit_deal.v1"},{"card_encoding":"project_target_v1_suit_major_hdcs_rank_2_to_ace","deal_id":"sha256:724e225172d71b3f6d53a919464550f79c7d5007b637d15055b4c6a6353bac04","dealer":1,"hands":[["2H","3H","4H","5H","6H","7H","8H","9H","10H","JH","QH","KH","AH"],["2D","3D","4D","5D","6D","7D","8D","9D","10D","JD","QD","KD","AD"],["2C","3C","4C","5C","6C","7C","8C","9C","10C","JC","QC","KC","AC"],["2S","3S","4S","5S","6S","7S","8S","9S","10S","JS","QS","KS","AS"]],"ruleset_id":"project_target_v1","schema_version":"tuppi.engine.explicit_deal.v1"},{"card_encoding":"project_target_v1_suit_major_hdcs_rank_2_to_ace","deal_id":"sha256:cf06a3fd72c241769e51ffc79aa1b68e439f9afe80cfa44d77955a2387e42c80","dealer":2,"hands":[["2C","3C","4C","5C","6C","7C","8C","9C","10C","JC","QC","KC","AC"],["2S","3S","4S","5S","6S","7S","8S","9S","10S","JS","QS","KS","AS"],["2H","3H","4H","5H","6H","7H","8H","9H","10H","JH","QH","KH","2D"],["AH","3D","4D","5D","6D","7D","8D","9D","10D","JD","QD","KD","AD"]],"ruleset_id":"project_target_v1","schema_version":"tuppi.engine.explicit_deal.v1"},{"card_encoding":"project_target_v1_suit_major_hdcs_rank_2_to_ace","deal_id":"sha256:dee251bda6ec4233ece5694bc5e7ab8dd4f7fecbed817575c8c3b8040819fc62","dealer":3,"hands":[["AH","2H","2D","3D","4H","5H","6H","7H","8H","9H","10H","JH","QH"],["3H","KH","4D","5D","6D","7D","8D","9D","10D","JD","QD","KD","AD"],["2C","3C","4C","5C","6C","7C","8C","9C","10C","JC","QC","KC","AC"],["2S","3S","4S","5S","6S","7S","8S","9S","10S","JS","QS","KS","AS"]],"ruleset_id":"project_target_v1","schema_version":"tuppi.engine.explicit_deal.v1"}],"initial_dealer":0,"initial_score":[0,0],"match_input_id":"sha256:51a8b564ed74ae52390e638e70374081e224d16862fd50c7ba334c39f588b190","match_ref":"example-exact-52","ruleset_id":"project_target_v1","schema_version":"tuppi.engine.match_input.v1"}
