{"deals":[{"card_encoding":"project_target_v1_suit_major_hdcs_rank_2_to_ace","deal_id":"sha256:bb19e3bc5107aa7fe4e9a4296b1dcbd6126598c20d7ed3685a6ee2fe35614ac3","dealer":0,"hands":[["3H","4H","5H","6H","7H","8H","9H","3D","4D","5D","6D","7D","8D"],["2H","10H","JH","QH","KH","AH","2D","10D","JD","QD","KD","AD","2C"],["9D","3C","4C","5C","6C","7C","8C","9C","10C","JC","QC","KC","AC"],["2S","3S","4S","5S","6S","7S","8S","9S","10S","JS","QS","KS","AS"]],"ruleset_id":"project_target_v1","schema_version":"tuppi.engine.explicit_deal.v1"}],"initial_dealer":0,"initial_score":[0,0],"match_input_id":"sha256:f899909aa369cb1e7c46452e2c4f60cc2758bcc4d6755285b5632f1234fc05da","match_ref":"example-no-eligible-show","ruleset_id":"project_target_v1","schema_version":"tuppi.engine.match_input.v1"}
